{"verdict":"reject","summary":"The revision closes many earlier gaps, but it still has two dispatch-blocking defects and several fail-open ambiguities. Task 0 cannot perform its declared compatibility refactor within its exact write scope, and the three-event telemetry protocol is implemented as utilities without end-to-end ownership for normal-run binding or terminal actual events. The post-diff “trivial” exceptions and missing-taxonomy behavior also permit implementations that contradict the plan’s fail-closed premise.","findings":[{"severity":"critical","category":"partition","claim":"Task 0's declared write scope omits an existing file it explicitly requires modifying.","evidence":"Plan lines 77-82 declare Task 0's exact files, but lines 91-102 require refactoring `load_config_models` into a compatibility wrapper. That function exists in `scripts/compound-v-resolve-model.py:115`, which is not in Task 0's Files list. The existing dispatcher scope-gates every job, so performing the refactor would be BLOCKED; omitting it would leave the promised shared loader migration incomplete. G1's `(+ its config-writer script if separate)` at plan line 208 is likewise not an exact file declaration.","recommendation":"Add `scripts/compound-v-resolve-model.py` explicitly to Task 0's write scope and shared resources. Replace G1's conditional parenthetical with an exact file list before materializing the manifest."},{"severity":"critical","category":"coupling","claim":"The append-only telemetry functions are not wired to all required lifecycle events, so Tier 2 and precision can remain permanently incomplete.","evidence":"A3 appends `predicted` (plan lines 303-309), and M1 appends `bind` only for accepted fast paths (lines 384-395). No C2, H1, or M1 step calls `append_actual` at MERGED or ESCALATION, and no task binds a declined/FULL_PIPELINE pre-evaluation when the normal orchestrator later creates a run. This contradicts spec lines 84-93, which require bind for any request that becomes a run and actual at MERGED/ESCALATION. The spec also says full-pipeline outcomes provide escalation evidence, which is impossible without this wiring.","recommendation":"Give explicit ownership to `commands/v-orchestrate.md` for binding every pre-eval-backed run, and to `agents/parallel-dispatcher.md` for idempotently appending and committing `actual` at both MERGED and ESCALATION. Add end-to-end fixtures for fast-path success, escalation, declined/full-pipeline, duplicate resume, and crash recovery."},{"severity":"high","category":"risk","claim":"The post-diff analyzer's parser-free “trivial string/comment” and tiny-CSS exceptions are not semantically safe and can silently miss high-impact changes.","evidence":"Plan lines 267-276 allow JS/TS/Go/Ruby changes to avoid escalation when a cheap check labels them comment/string/whitespace, and require a clean tiny CSS diff not to escalate. A string-only change can flip a feature flag, alter legal copy, break an i18n placeholder, or change a config constant—the exact content-sensitive hazards introduced in B1. A same-file tiny CSS diff can introduce or alter a shared token or accessibility state after localization. F2's stated tests do not require matching added/removed hunks through `match_content`.","recommendation":"Treat string-literal changes as semantic unless a real parser plus a narrowly defined rule proves otherwise. Run taxonomy content matching over changed hunks and re-check shared-token/a11y flags post-diff. Add fixtures for feature-flag strings, legal copy, placeholders, config literals, and newly introduced shared/a11y CSS constructs."},{"severity":"high","category":"acceptance","claim":"The supposedly deterministic T3 band composition is under-specified, especially when taxonomy data is absent.","evidence":"Spec lines 245-251 map `user-facing-minor` to `low/med`, which is not a deterministic value, and provide no complete category-to-impact mapping. Spec line 262 says a missing taxonomy degrades to T2/T3, even though the sensitive-path and content-pattern protections then do not exist. A worker could reasonably map `plumbing` or `user-facing-minor` to low impact and offer a fast path without the taxonomy needed to prove safety.","recommendation":"Define a total truth table from every T3 enum to both axes. Make missing, malformed, or unavailable taxonomy/snapshot an unconditional FULL_PIPELINE result; T3 may raise a taxonomy result but must not manufacture fast-path eligibility without T1 safety coverage."},{"severity":"high","category":"risk","claim":"Fast-path materialization is multi-commit but lacks crash-consistent reconciliation between its commit boundaries.","evidence":"M1 commits evidence/snapshot, then manifest/state at `FASTPATH_DISPATCHED`, then appends bind (plan lines 384-395). Its fixture covers only success and pre-commit tampering. A crash after state is committed but before bind lets `/v:resume` dispatch the run while telemetry remains unbound; a crash after the first commit leaves a partial deterministic run with no specified recovery rule. AC-15's reconciliation covers escalation, not initial materialization.","recommendation":"Define an idempotent materialization protocol and test a crash after every write/commit boundary. Either commit `FASTPATH_DISPATCHED` last or add a materialization status/receipt that resume reconciles before dispatch."},{"severity":"high","category":"acceptance","claim":"F2's declared numstat method cannot include untracked files, allowing large untracked diffs to evade the size threshold.","evidence":"Plan lines 264-267 require size from `git diff --numstat <baseline>` “including untracked.” Git diff does not report untracked files. The fixture at lines 272-277 only says an untracked file is “seen,” not that its line/byte contribution is included or that an oversized untracked file escalates.","recommendation":"Specify separate size accounting for untracked paths, with binary detection and bounded reads, then union it with tracked numstat. Add oversized text and binary untracked fixtures that must escalate."},{"severity":"high","category":"model-routing","claim":"Moving the combined review outside `jobs` removes the existing enforceable deep/Opus invariant, while the proposed result cannot prove which tier ran it.","evidence":"C1 requires review as a dispatcher phase outside `jobs` (plan lines 226-228), but `scripts/compound-v-validate-manifest.py:765-775` enforces reviewer depth only while iterating manifest jobs. H1 says it rejects wrong-tier review results, yet `schemas/job_result.schema.json` contains no backend, model, tier, or effort field. The only remaining guarantee is prose in C2's parent-Task instruction.","recommendation":"Add a validator-enforced `fast_path.review` phase contract containing backend/tier/effort, and persist a trusted dispatcher-generated invocation receipt with the resolved model. Validate that receipt on re-entry rather than trusting model-returned metadata."},{"severity":"medium","category":"acceptance","claim":"Bounded localization does not test compliance with the global external-process containment invariant.","evidence":"A1 invokes `rg`, `git grep`, and `grep` with a hard timeout (plan lines 125-137), but its selftest checks only localization semantics and write-once output. Unlike A2 and D1, it does not require a fake-CLI fixture proving use of `compound-v-run-with-timeout.py`, closed stdin, process-group termination, or bounded output. An implementation using ordinary `subprocess.run(timeout=...)` would satisfy A1's listed tests while violating the global invariant.","recommendation":"Add fake-CLI tests for every localization fallback proving supervisor routing, `stdin=DEVNULL`, process-group timeout, output bounds, and fail-closed behavior."}],"blind_spots_checked":["Expanded declared file ownership against existing shared-loader and config files; no literal A-H file overlap was found, but Task 0 has an undeclared required write.","Traced every DAG reader to its author and checked the current dispatcher requirement that prerequisite merge-backs be committed before dependent worktrees start.","Traced predicted, bind, and actual telemetry events through fast-path, full-pipeline, merge, escalation, and resume paths.","Checked pre-run record and immutable taxonomy-snapshot sequencing.","Checked missing-taxonomy and T3 behavior against the fail-closed invariant.","Checked post-diff handling for tracked, committed, renamed, deleted, binary, and untracked changes.","Checked review model enforcement against the current manifest validator and canonical job-result schema.","Checked crash boundaries for escalation and initial fast-path materialization.","Checked external CLI timeout and closed-stdin coverage.","Checked implementer model routing; no Codex-without-worktree route or security task on a light tier was declared."]}